card_id,card_type,card_text,expansion,is_active
1,dare,Sit on another players lap until your next turn (or they can sit on yours),core,1
2,dare,Remove an article of clothing.,core,1
3,dare,Fake an orgasm.,core,1
4,dare,Flash or moon everyone.,core,1
5,group,All players of the opposite sex remove an article of clothing.,core,1
6,dare,Give a 30 second lap dance to another player.,core,1
7,dare,"Whisper ""I want to fuck the shit out of you,"" or something similarly filthy into another players ear.",core,1
8,dare,Get 5 spanks from another player.,core,1
9,dare,Blow a raspberry on the stomach of another player.,core,1
10,challenge,Use your best pick up line on another player. They use theirs on you. The group picks the winner.,core,1
11,dare,Let everyone grab your ass.,core,1
12,dare,Do a body shot off another player.,core,1
13,dare,Survive 30 seconds of being tickled by another player.,core,1
14,challenge,Go around the room and name different sex toys. First hesitation or repeat loses.,core,0
15,challenge,"Spin the bottle. Kiss that player, or pass your spin to them.",core,1
16,challenge,Tell two truths and a lie. Choose a player to answer.,core,1
17,dare,Show the group a photo from your secret collection.,core,1
18,group,"On 3, everyone point to the player who you think has partaken in the most anal.",core,1
19,dare,"Pin, or let another player pin you against the wall for 30 seconds.",core,1
20,dare,Choose another player to remove an article of clothing from you.,core,1
21,dare,Use your foot to rub another players crotch for 30 seconds.,core,1
22,challenge,Wild Card - This card allows you to choose what you want done to you and by whom.,core,1
23,group,"Everyone who has had sex in the last 24 hours, removes an article of clothing.",core,1
24,dare,Let another player unbutton or unzip one item of your clothing and leave it that way.,core,1
25,dare,"Give another player a slow, 60-second back or shoulder massage.",core,1
26,group,Everyone close their eyes. On 3 point to the player in the room with the best body. Open your eyes.,core,0
27,truth,Have you ever had a threesome?,vanilla,1
28,truth,Point to the players in the room you want to see fuck each other the most.,vanilla,1
29,truth,What is your record for how many times you've masturbated in a 24 hour period?,vanilla,1
30,truth,What is your favorite sex position?,vanilla,1
31,truth,Name your most unusual celebrity crush.,vanilla,1
32,truth,Have you ever filmed a porno?,vanilla,1
33,truth,Have you ever given or received road head?,vanilla,1
34,truth,Are you a member of the mile high club?,vanilla,1
35,truth,What was the last role play scenario you and your partner performed?,vanilla,1
36,truth,Would you rather watch your partner have a threesome with another couple or have your partner watch you?,vanilla,1
37,truth,Have you ever had anal sex? Did you enjoy it?,vanilla,1
38,truth,Do you like to be spanked? Are you into dom/sub play or any sort during sex?,vanilla,1
39,truth,"Have you ever done anything sexual with someone of the same sex? If not, would you?",vanilla,1
40,truth,Voyeur or Exhibitionist?,vanilla,1
41,truth,"Name two places, outside of the house, where you would like to have sex.",vanilla,1
42,truth,What turns you off?,vanilla,0
43,truth,Is there anything you won't do in bed?,vanilla,1
44,truth,Describe your sexual fantasy in as much detail as possible.,vanilla,1
45,truth,"If you could have sex with any celebrity, whom would you choose?",vanilla,1
46,truth,What is the most embarrassing thing you've done to get someone's attention?,vanilla,1
47,truth,Have you ever lied to get someone into bed? What did you say?,vanilla,1
48,truth,What body part on another person do you notice first? Who in the group has the best?,vanilla,1
49,truth,Have you ever had a sex dream about someone in this room?,vanilla,1
50,challenge,Make prolonged eye contact with the player across from you for 30 seconds without laughing or looking away.,core,1
51,truth,Have you ever hooked up with someone you met that same night? How did it go?,vanilla,1
52,truth,Have you ever sent or received a nude photo? Any regrets?,vanilla,1
53,truth,Have you ever had sex in a public place with a real risk of being caught?,vanilla,1
54,truth,What is the most adventurous place you have ever had sex or fooled around?,vanilla,1
55,truth,Have you ever faked being asleep to avoid or initiate sex?,vanilla,1
56,truth,What is the longest you have gone without sex as an adult?  What broke the streak?,vanilla,1
57,truth,What is a sexual experience you have had that you have never told anyone about?,vanilla,0
58,truth,Have you ever been caught in the act? What happened?,vanilla,1
59,dare,Check a player for breast or testicular cancer.,pineapple,1
60,challenge,"Give another player a semi-chub, or erect nipple in 30 seconds or less.",pineapple,1
61,dare,Motorboat another player.,pineapple,1
62,dare,Sit on another players lap (or they can sit on yours) and give them a hickey.,pineapple,1
63,dare,Have another player write their name on your tits or ass.,pineapple,1
64,challenge,Have two players kiss you. Pick the winner.,pineapple,1
65,dare,Rub another players crotch for 30 seconds.,pineapple,1
66,dare,"Pick two people and all three of you stand. Rub them both below the waist simultaneously, while kissing one of them.",pineapple,1
67,dare,"While kissing another player, guide their hand to a place you want them to rub.",pineapple,1
68,challenge,"Close your eyes, and a random player must kiss you. If you guess who it was, they lose.",pineapple,1
69,dare,Offer your partner to be felt up by the group for a minute.,pineapple,1
70,dare,Help another player remove an article of clothing.,pineapple,1
71,dare,"Stimulate two parts of another players body at the same time. Use your hand on one part, and your mouth on another.",pineapple,1
72,challenge,"You're the director. Select your cast and have them perform a short scene. If they refuse, they lose.",pineapple,1
73,dare,"You and your partner choose another player and double team them using your lips, tongue, and hands.",pineapple,1
74,dare,Text another player a nude.,pineapple,1
75,challenge,Seven Minutes in Heaven - Disappear to a secluded location with another player for seven minutes.,pineapple,1
76,dare,Kiss the neck of another player for 10 seconds.,pineapple,1
77,challenge,Two players compete to see who has the best dirty talk. The room votes on the winner.,pineapple,1
78,dare,Sit in another player's lap and stay there until your next turn.,pineapple,1
79,group,Hot Seat - All players must ask you questions for 30 seconds. You must answer truthfully or you lose.,vanilla,1
80,group,All players of the same sex remove an article of clothing.,core,1
81,truth,What is your best skill in bed?  What is your partners?,vanilla,1
82,challenge,The group chooses a player for you to thumb wrestle. The loser removes an article of clothing.,core,1
83,truth,Would you consider an open relationship? What would your rules be?,vanilla,1
84,truth,What's one sexual experience on your bucket list you haven't crossed off yet?,vanilla,1
85,truth,What's the most number of people you've kissed in a single night?,vanilla,1
86,dare,"A player covers your eyes. Another random player wispers ""I want you to fuck me silly"" into your ear. Guess who it was.",core,1
87,dare,Another player must use their hands to act as your bra or jock strap through the next players turn.,pineapple,1
88,group,The entire group chooses a partner and freak dances with them for 60 seconds.,pineapple,1
89,challenge,You and another player each give a 30 second lap dance to a third player.  That player chooses the winner.,pineapple,1
90,truth,Who in this room would you most want to watch your partner with? Why?,vanilla,1
91,truth,What is one thing your partner does in bed that you secretly want to brag about?,vanilla,1
92,group,Suck and blow - The group passes a playing card or similar item around the group using only their lips.,core,1
